Job_title,Company,Location,Salary,Posted,Job_description
Senior Systems & Data Analyst,Cobalt Recruitment.,"Manchester, Greater Manchester",£40000.00 - £50000.00 per annum,Posted 3 days ago,"Senior Systems and Data Analyst Manchester/ Hybrid £40,000 - £50,000 Company Overview Cobalt is delighted to be supporting a well-respected Residential Asset Manager based in Central Manchester. Over the past 18 months, they have seen significant growth across their portfolio and are continually growing this. As part of their growth strategy, they are looking for a well-rounded & confident Senior Systems and Data Analyst to work closely with Senior Leadership and Investors to ensure robust data is held, analysed & reported internally & externally within the systems and technology stack Role Responsibilities * Responsible for developing data visualisation through Power BI and other reporting tools, ensuring the business has the performance data required. * Plan and oversee the release of enhancements and upgrades of systems"
Data Centre Facilities Engineer,Barker Phillips,"ST6, Stoke-On-Trent","Up to £24,000 per annum",Posted 4 days ago,"Superb hybrid working opportunity for an award-winning tech business that provides data centred solutions for companies globally. To take a proactive approach to implementing and monitoring change within the data centres, aiming to reduce risk, cost and/or impact to the environment so far as practicable. Managing own projects to identify and introduce new processes and technologies within the data centre environments. Power distribution: Generators, Uninterruptable Power Supply, Mains distribution. Cooling: Air conditioning units, Airflow management, Humidity control. Capacity: Rack space, networking, power and cooling. Fire protection: Gas-based suppression systems, detection. You will have - Strong planning and organisational skills. Ability to manage own time to meet deadlines. Strong analytical and problem-solving skills."
Solution Architect (Data),National Nuclear Laboratory,"WA3, Warrington, WA3 6AE",Competitive,Recently,"Job Introduction Job Description forSolution Architect (Data); There's never been a more exciting time to be part of the nuclear sector. New opportunities are being created all the time. At NNL, you'll be in the ideal place to capitalise on this momentum, face new challenges and develop a long, successful and meaningful career. We're an organisation that's here to experiment and push the limits of what's possible. So, if you're keen to excel in your chosen field, this is the place to do it. Because at NNL, anything is possible. This is a key role in the IT Architecture team, providing an exciting greenfield opportunity for someone with experience and knowledge of modern data platform architectures."
Data Engineer,Searchability (UK) Ltd,"Wigan, Greater Manchester",Up to £80000 per annum,Posted 7 days ago,"We are a Sports Software House with offices all across the UK. We were established over 100 years and have continuously grown since we opened our doors! We are looking for a Data Engineer to come in and hit the ground running providing support to the Data community. * Salary up to £80,000 + benefits * 1 x per month in the office in Wigan * AWS or Azure / Data Lakes /Snowflake / Python /ETL * You will an integral part of our movement from our legacy systems to the AWS cloud where we will be revolutionizing our data platforms in an effort to move towards more Machine Learning and Analytical processes. * You will work with a variety of different data lake technology tools and Woking closely with our data product owner to create and execute modern solutions for a variety of challenges and problems."
Electrical Engineering Industrial Placement,Bentley Motors,"CW1, Crewe, CW1 2RP",Competitive,Recently,"CONTRACT: 12 MONTH INDUSTRIAL PLACEMENT START DATE: AUGUST 2023 SALARY: £19,893 PER ANNUM LOCATION: BASED IN CREWE - HYBRID and FLEXIBLE WORKING Extraordinary Opportunities Electrical Engineering The Vehicle Systems & Infrastructure department within the Electrical Engineering function is responsible for providing the ""backbone"" for vehicle functions and systems. You will receive a high level overview of vehicle electrical systems from electrical architecture definition to specification of the electrical physical layers and functions. At the same time you will also work with highly specialised engineering teams where you will work with complex systems and electrical engineering development."
Engineer - Java - Customer & Data,Sainsbury's,"M4, Manchester, M4 3AL",Competitive plus benefits,Recently,"Job Description We're a multi-channel, multi-brand business serving millions of customers a day, with the UK's largest loyalty scheme and an ever-evolving set of digital platforms. All of this equals over 1.2 billion transactions each year, presenting a volume, depth and complexity of data that few can match. We don't think we're exaggerating when we say we have the most exciting data set in the country. And from the insights gained, we build scalable, high-performance products using cutting-edge technology that give our customers an amazing shopping experience - like our award-winning Smartshop app. In an inclusive, agile environment, you'll have the space to be curious, to experiment, and to solve real-world challenges. And you'll get to see your creations in the hands of millions of people across the UK."
Head of Engineering (£120k + 40% bonus),ECOM Manchester,"Manchester, Greater Manchester",£100k - 120k per year + 40% bonus,Posted 10 days ago,"Great opportunity for a Head of Engineering to join an ecommerce company in Manchester that have ambitions to become Europe’s leading online retailer in their industry. The technology department is evolving to cross functional product-based teams that use data to inform decisions, a continuous delivery environment and a cloud based, decoupled architecture. As Head of Engineering, you’d report to the Director of Engineering and would work alongside a Head of Product. You’d manage multiple Engineering Managers who each look after multiple cross functional product-based teams so you must have experience operating at scale (50+ people). * Background as a hands-on software engineer * Servant leader for cross functional product engineering teams * Experience working in agile culture and creating an agile/lean ethos * Deep understanding on engineering best practice"
Software Engineering Contract - Paying £550-£600 p/d Inside,Oliver Bernard Ltd,"Salford, Greater Manchester",£550 - £600 per day,Posted 9 days ago,"I'm working a contract role for a household UK media company. They are looking for a Software Engineer to join their team. Please see the details below. The role requires for you to work primarily on the Back-end to move and manipulate data from the content team's systems and platforms. They are looking for a candidate who has experience working with Java OR Python, and has strong experience working with Kubernetes and AWS. * Hybrid - twice a week in Glasgow or Salford * Paying £550-£600 p/d inside IR35 * Experience working in an Agile environment * Experience with pair programming (must be comfortable to do this for this role) * Desireable to have worked with Clojure If this sounds of interest, please get in touch."
Senior Data Architect - London,William Hill,"M1, Manchester",Unspecified,Recently,"London Office Discaimer: William Hill can only offer this position to candidates which have Right to Work in Uk. About us Our people are at the heart of everything we do and we offer a fast-paced environment where we have fun, celebrate success and give you all the tools youll need to be your best self. It's not just our colleagues we look after - we've got a responsibility to our customers too and we work hard on our William Hill Protect + Play initiative. We have welcomed our teams back to the office and have a balanced approach to office and home working. Our employees have the opportunity to work from home up to 80% of the time with 20% of office time built in to ensure we get some face-to-face collaborative team time - and the chance for a coffee and a catch up! Your role in the team"
Data Consultant,Beaumont IT,"M1, Manchester","From £45,000 to £80,000 per annum",Posted 10 days ago,"About the job If its working on greenfield project work and the opportunity to grow and nurture client relationships within Azure Data, this a great opportunity for you!! We here at Beaumont-IT are partnered with one of the UK's most successful Microsoft gold partners, they are an MSP who specialise in Data/ Software development and infrastructure solutions focused within Azure, they work with governing bodies from local councils, to the Metropolitan Police all the way to SC cleared projects. Due to an internal promotion there is now a position available for a Data Engineer/Consultant to take that next step in there careers or an existing Consultant to come and grow with the company, to there write their signature on the project work and really push the team forward."
Interim Engineering Maintenance Manager - Logistics,Bis Henderson,"BB1, Blackburn",Up to £400.00 per day,Posted 13 days ago,"Location: Blackburn Salary: c£400 per day We are working with a Logistics distributor, who are seeking a Interim Engineering Maintenance Manager on a 6 month basis. You will be tasked with supporting the management team and current team of maintenance engineers, driving efficiencies and improvement in the maintenance operation and almost owning the analysis of what needs to be done to improve the operation. You will be managing a tender for outsourcing parts of the maintenance operation, involved in the selection process and subsequent tupe across. Experience in automated logistics operations would be advantageous. Processing Your Data Bis Henderson Recruitment is a leading provider of recruitment, interim management and consultancy services to the supply chain and logistics industry."
Industrial Engineering Project Manager,Nexperia,"Marcliffe Ind Est, SK7 5BJ",Unspecified,Recently,"About the role Nexperia is a world-class leader in semiconductor development and in-house production committed to ongoing investment in next generation technologies, state of the art high-volume manufacturing facilities and above all, people! We have exciting opportunities for (Front End) Industrial Engineering Project Managersto support our newly created Central Industrial Engineering team in maximising the production capability and efficiency of Nexperias wafer fabs by leading and driving industrial engineering related activities and projects. What you will do * Lead complex improvement projects and exchange best practices within the central IE team * Take on team leadership including operational guidance and conflict management * Drive fast screening analyses to identify the potential for more wafer-starts with existing equipment"
Data Scientist,ARM,"Manchester, Greater Manchester",Competitive,Recently,"Are we right for you? Arm is looking to welcome a Data Scientist into one of our growing analysis teams, based in our Manchester office, working in Python to help us deliver tools and analysis software for our GPU software projects and teams. We'd like you to bring passions for software development, the power of working as a team, and personal development and, in return, the team will provide you with mentorship, a collaborative environment for you to grow your career, and exposure to technology that will be the foundation for innovative products for years to come! About the role Our team uses Python, data science and other technologies to create a suite of tools and services used internally by our 100+ software engineering team. Our engineers use this to understand the quality of the GPU software products they are developing and testing."
Reliability Maintenance Engineering Technician,Amazon,UK,Competitive,Recently,"Join us in the Amazon Reliability Maintenance Engineering team. We maintain and optimize technologies in the Global Amazon Warehouse & Delivery Network. We are looking for a motivated technician who enjoys working in a team. The job is about maintaining our equipment in a safe way to a high standard. Focusing on planned preventative maintenance you will engage in mitigation of risks by proactively addressing and resolving issues. Raising the availability and quality of the equipment is the daily job. Our technicians focus in on our operational team, their customers, with support from the team and their leaders. Shift Pattern: This role includes working in non-traditional shift pattern, which may include nights and weekends Clustering: This role includes working across multiple sites. On-Call: This role includes being on-call for emergency cover"
Reliability Maintenance Engineering Technician,Amazon,UK,Competitive,Recently,"Join us in the Amazon Reliability Maintenance Engineering team. We maintain and optimize technologies in the Global Amazon Warehouse & Delivery Network. We are looking for a motivated technician who enjoys working in a team. The job is about maintaining our equipment in a safe way to a high standard. Focusing on planned preventative maintenance you will engage in mitigation of risks by proactively addressing and resolving issues. Raising the availability and quality of the equipment is the daily job. Our technicians focus in on our operational team, their customers, with support from the team and their leaders. Shift Pattern: This role includes working in non-traditional shift pattern, which may include nights and weekends Clustering: This role includes working across multiple sites. On-Call: This role includes being on-call for emergency cover"
Reliability Maintenance Engineering Technician,Amazon,UK,Competitive,Recently,"Join us in the Amazon Reliability Maintenance Engineering team. We maintain and optimize technologies in the Global Amazon Warehouse & Delivery Network. We are looking for a motivated technician who enjoys working in a team. The job is about maintaining our equipment in a safe way to a high standard. Focusing on planned preventative maintenance you will engage in mitigation of risks by proactively addressing and resolving issues. Raising the availability and quality of the equipment is the daily job. Our technicians focus in on our operational team, their customers, with support from the team and their leaders. Shift Pattern: This role includes working in non-traditional shift pattern, which may include nights and weekends Clustering: This role includes working across multiple sites. On-Call: This role includes being on-call for emergency cover"
Reliability Maintenance Engineering Technician,Amazon,UK,Competitive,Recently,"Join us in the Amazon Reliability Maintenance Engineering team. We maintain and optimize technologies in the Global Amazon Warehouse & Delivery Network. We are looking for a motivated technician who enjoys working in a team. The job is about maintaining our equipment in a safe way to a high standard. Focusing on planned preventative maintenance you will engage in mitigation of risks by proactively addressing and resolving issues. Raising the availability and quality of the equipment is the daily job. Our technicians focus in on our operational team, their customers, with support from the team and their leaders. Shift Pattern: This role includes working in non-traditional shift pattern, which may include nights and weekends Clustering: This role includes working across multiple sites. On-Call: This role includes being on-call for emergency cover"
Senior Reliability Maintenance Engineering Technician,Amazon,UK,Competitive,Recently,"Amazon Operations sits at the heart of the Amazon customer experience. We look after everything from the moment a customer clicks buy, to the moment their item is delivered from desktop to doorstep. Across Europe we have more than 50 Fulfillment Centers, hundreds of Delivery Stations, thousands of machines, and tens of thousands of employees, all working together in harmony to make sure the right item gets delivered to the right person, in the right place, at the right time. Working in Amazon Operations is for people who like to be active and give their all. We work in a busy, dynamic environment and are part of a bigger team delivering on the expectations of millions of customers every single day. We are open, inclusive and welcome individuality and diversity."
Senior Reliability Maintenance Engineering Technician,Amazon,UK,Competitive,Recently,"Amazon Operations sits at the heart of the Amazon customer experience. We look after everything from the moment a customer clicks buy, to the moment their item is delivered from desktop to doorstep. Across Europe we have more than 50 Fulfillment Centers, hundreds of Delivery Stations, thousands of machines, and tens of thousands of employees, all working together in harmony to make sure the right item gets delivered to the right person, in the right place, at the right time. Working in Amazon Operations is for people who like to be active and give their all. We work in a busy, dynamic environment and are part of a bigger team delivering on the expectations of millions of customers every single day. We are open, inclusive and welcome individuality and diversity."
Reliability Maintenance Engineering Technician,Amazon,UK,Competitive,Recently,"Amazon Operations sits at the heart of the Amazon customer experience. We look after everything from the moment a customer clicks buy, to the moment their item is delivered from desktop to doorstep. Across Europe we have more than 50 Fulfillment Centers, hundreds of Delivery Stations, thousands of machines, and tens of thousands of employees, all working together in harmony to make sure the right item gets delivered to the right person, in the right place, at the right time. Working in Amazon Operations is for people who like to be active and give their all. We work in a busy, dynamic environment and are part of a bigger team delivering on the expectations of millions of customers every single day. We are open, inclusive and welcome individuality and diversity."
Reliability Maintenance Engineering Technician,Amazon,UK,Competitive,Recently,"Amazon Operations sits at the heart of the Amazon customer experience. We look after everything from the moment a customer clicks buy, to the moment their item is delivered from desktop to doorstep. Across Europe we have more than 50 Fulfillment Centers, hundreds of Delivery Stations, thousands of machines, and tens of thousands of employees, all working together in harmony to make sure the right item gets delivered to the right person, in the right place, at the right time. Working in Amazon Operations is for people who like to be active and give their all. We work in a busy, dynamic environment and are part of a bigger team delivering on the expectations of millions of customers every single day. We are open, inclusive and welcome individuality and diversity."
Senior Reliability Maintenance Engineering Technician,Amazon,UK,Competitive,Recently,"Amazon Operations sits at the heart of the Amazon customer experience. We look after everything from the moment a customer clicks buy, to the moment their item is delivered from desktop to doorstep. Across Europe we have more than 50 Fulfillment Centers, hundreds of Delivery Stations, thousands of machines, and tens of thousands of employees, all working together in harmony to make sure the right item gets delivered to the right person, in the right place, at the right time. Working in Amazon Operations is for people who like to be active and give their all. We work in a busy, dynamic environment and are part of a bigger team delivering on the expectations of millions of customers every single day. We are open, inclusive and welcome individuality and diversity."
Finance Data Manager,N Brown Group,"Ancoats, M60 6ES",Competitive,Posted 14 days ago,"Here at N Brown, were looking for an experienced Finance Data Manager to join our Finance team About the Role As the company looks to improve the accuracy of our forecasts, this role has been created to work between the developers, Brand Planning Managers, Commercial and Central Finance. The role will play a pivotal part integrating the tools into the group, providing 360 feedbacks, ensuring the inputs and outputs are projecting the most accurate forecast by brand. You will work alongside data science to produce a Sessions forecast as our brands move fully online, linking with key areas (Media, B&M, FS and Logistics and Finance) via the Retail Forecast. The outputs will enable agile trading and lead to improved ROI and by pulling together KPI level detail on trade (from multiple sources) will provide interpretation to the trading teams. About You"
Product Engineering Software Graduate - Manchester,Jaguar Land Rover,"Knott Mill, M1 4ET",To define,Recently,"Company description:A leading premium automotive business and leading to move towards electric autonomous vehicles. Job description:We are the future of modern luxuryWe are the pioneers creating the next-generation of outstanding vehicles,?founded on modern luxury. Each and every one of us are shaping the?exceptional with soul. We are reimagining the driving of tomorrow?and redefining what's possible. We are the future of movement. We can't wait to see what you can do with us. Software EngineeringAutomobiles are becoming more and more reliant on software every year and modern Jaguar Land Rover vehicles feature the most advanced technology in the industry. Before drivers get in our cars, software identifies their key fob and unlocks the vehicle."
Engineer - Frontend - Customer and Data,Sainsbury's,"M4, Manchester, M4 3AL",Competitive plus benefits,Recently,"Job Description We're a multi-channel, multi-brand business serving millions of customers a day, with the UK's largest loyalty scheme and an ever-evolving set of digital platforms. All of this equals over 1.2 billion transactions each year, presenting a volume, depth and complexity of data that few can match. We don't think we're exaggerating when we say we have the most exciting data set in the country. And from the insights gained, we build scalable, high-performance products using cutting-edge technology that give our customers an amazing shopping experience - like our award-winning Smartshop app. In an inclusive, agile environment, you'll have the space to be curious, to experiment, and to solve real-world challenges. And you'll get to see your creations in the hands of millions of people across the UK."
Technical Lead - Software Engineering,ARM,"Manchester, Greater Manchester",Competitive,Recently,"We make debug tools that help Arm's partners build extraordinary software on their embedded devices which power mobile, games, Android, Linux, Machine Learning, and enterprise applications! We are looking for skilled and hardworking software engineers who are passionate about producing quality software to join our engineering teams. In this role, you will work in our Agile team on the development of our Java and C++ based tools. Working with a team of engineers, you will be involved in the full software development lifecycle, from working with our Product Managers to clarify requirements through to design, development and deployment of new features! * You will implement new features for our suite of debug tools, such as Arm Development Studio ( and develop firmware for our DSTREAM family ( of high performance debug and trace probes."
Graduate Data Analyst,Grayce,"Baring Street Ind Est, M1 2EH",Unspecified,Recently,"Are you looking to kickstart your career? Join our team of Data changemakers across the UK! As an Analyst within our Data+ programme you will embark on our development programme. Our dynamic Data+ programme is designed for Graduates with a passion for all things Data! Whether you are looking to specialise in Data Science, Data Engineering, Architecture or BI & Analytics, the Data+ development programme will support you in meeting and exceeding your career goals. Building your skill stack You will begin with a 3-week data bootcamp, where you will join other graduates and work together to build your foundations in the data space. With accredited qualifications and training provided by our talented Grayce data coaches, you will have every opportunity to improve and develop your skills."
Manufacturing Engineering and Industrialisation Manager,Glen Callum Associates Ltd,"Mill Business Park, WN1 1BJ",Bonus + Pension + Life Assurance + Health,Posted 21 days ago,"We are looking to hire an experienced, performance driven Manufacturing Engineering Manager to plan, coordinate and control all manufacturing engineering and Product Industrialisation activities with a focus on achieving budget and production targets. This is a fantastic opportunity to work for a Global player within the industrial, MRO and automotive industries. If you have a proven manufacturing engineering leadership background combined with a knowledge of Product Industrialisation and plant set-up, you can expect to thrive in a forward thinking, leading brand and in return you will receive a competitive salary and benefits package including several bonuses, Bupa, Westfield Health, an enhanced pension and life assurance."
