Job_title,Company,Location,Salary,Posted,Job_description
Data Architect,Sopra Steria Limited,UK,"From £60,000 to £80,000 per annum",Today,"Are you looking for your next exciting role in a growing and forward thinking organisation? We are recruiting for a Data Architect to join our Architecture practice. Within this role you will be designing and visualising the organisation's data management framework describing the processes used to plan, define, acquire, maintain and control data, and providing guidance on data governance, integration, security, master and metadata management, data acquisition and migration, and data quality principles. We can offer great career progression opportunities, ability to be based anywhere across the UK, benefits which you can flex to meet your needs and training and development opportunities."
Java Big Data Developer,Staffworx Limited,"HX1, Halifax",Up to £900 per day to £850 day inside IR35,Posted 6 days ago,"Lead Data Engineer (GCP, Java, Python, Kafka, K8S) - remote contract - high profile client Senior, Lead GCP Data Engineer - remote contract Senior Google Cloud Platform Data Engineer with strong Java and Python to lead data engineering workstream in design and build of data platform including data ingestion, streaming and data warehousing 6 months rolling contract, inside IR35, remote Experience * GCP (Google Cloud Platform) * Kafka, BigQuery, Kubernetes, SQL * Java & Python experience * Terraform * Data Engineering, Data Pipelines * Kafka connect & streams * work as a technical architect with a Data Architect or Data Modeler * Ability to lead data engineers * Working under DevOps and GitOps led processes and tools Contract will fall within scope of IR35, so umbrella company will need to be engaged. #gcp #kafka #dataengineer #java #k8s"
Data Engineer (Remote),Cloud Decisions,"Ancoats, M1 1AG",£60k - 70k per year + Certifications + Benefits,Posted 7 days ago,"Data Engineer / Consultant Remote role (UK based) c.£65k (can be flexible) + Bonus (up tp £10k) + Benefits As a Data Engineer /Consultant, you will be responsible for delivering, and deploying Data services based on the latest Microsoft Technologies. You will be working from home, having a major impact on developing Data Talent within the team (along side the Lead Architect) whilst working for a well respected and growing Gold Microsoft Partner. · Proven Data Engineering background within Microsoft environment · Solid SQL skills · Exposure/knowledge across Azure Data Services (Azure Data Factory + Synapse advantageous) · Excellent communication skills to liaise with internal team and customers · Relevant Microsoft Certifications (DP-203, DP-300 etc) · Azure Synapse experience · Python skills"
Lead Data Engineer,IQ TECH NORTH,"Manchester, Greater Manchester",£80k - 85k per year + flexible working and fantastic benefits package!,Posted 16 days ago,"**Exciting New Lead Data Engineer Opportunity not to be missed!** (Ideally 1 day a week at our client's fabulous office!) This is a brand-new role that has been created for growth purposes and an important one to lead and make a big impact on a small but growing, friendly Data Engineering team, whilst demonstrating a community of best practice. It is an exciting time to join in the early stages of our client’s data engineering journey, leading, line managing and coaching a successful team of 4 (3 Data Engineers and 1 DBA) which has been built slowly over last 6-9 months. As a Lead Data Engineer at the top of your technical profession, you will invest time in upskilling the team, particularly in Databricks, as this is the backbone of our clients’ data warehouse, so you will need to be an expert in Databricks and its components, including delta lakes etc."
Estimator,GPW Recruitment,"M1, Manchester",£35000 - £42000 per annum,Posted 2 days ago,"Job Title: Estimator Duration: Perm Location: Manchester Salary: £35,000 - £42,000per annum We're looking for a talented Estimator to work for our client based in Manchester. If that's you then you could be exactly what they're looking for. As the Estimator you will be primarily responsible for estimating production costs - Supporting telesales - Collecting quotes from material suppliers and sub-contractor - Assessing levels of risk and compiling quotations. - Liaising with and visiting customers will also be a part of the role so you must be prepared to travel if necessary. The ideal candidate for this Estimator role will require an understanding of simple to complex engineering drawings - Knowledge of materials and surface treatments - Understanding of 3D Model data"
Principal Data Engineer,BBC,"Salford, Greater Manchester",Competitive Salary + Benefits,Posted 23 days ago,"Job Introduction Are you looking for a role that builds on your experience with engineering data systems and brings hands-on experience with machine learning? Are you keen to learn, grow, and develop? Do you want to work in a nurturing culture where you can flourish and be your best? Would you like to work on services that are used by key BBC products and millions of people each day? If so, this opportunity could be for you. The Content Publishing team's mission is to build unrivalled fully-accessible tools to enable journalists across the globe to create, curate and describe the world's best journalism content in over 40 languages. Our team is central to the success of the BBC. We are in the middle of solving some big questions: How do we put tagging at the heart of a personalised BBC?"
Data Engineer,Cloud Decisions,"M11, Manchester, M11 2EP",£40k - 60k per year + Microsoft Certifications + Benefits,Posted 30 days ago,"Join an organisation recognised as a global leader. Those that join are exposed to; the latest technology, inclusive + flexible culture and guaranteed to evolve their skills at all levels. Offices across the UK Hybrid working (flexible arrangements) Up to £60k + Extensive Benefits (Engineer, Senior + Manager levels needed) Passionate about providing employees with the necessary skills, experience, and training to help development both personally and professionally * Relevant commercial experience in a Data Engineering role * SQL and Python skills * Practical experience working with cloud platforms (specifically Azure) * Experience building and maintaining data pipelines and architecture * Experience with both PaaS (Platform-as-a-Service) and IaaS (Infrastructure as a Service) * Open to learning new technologies, methodologies, and skills"
Senior Data Engineer,Randstad Tech IT,"M1, Manchester",£70000 - £90000 per annum,Expires in 1 day,"Randstad has recently partnered with a leading global financial services organisation, and is currently in the market for a Senior Data Engineer to come on board and join their Data Solutions Division in central Manchester. They are looking for someone who has cloud data engineering experience as well as being well versed in Python, working on complex data pipelines using AWS Lambda, Redshift, Serverless and more. * Well versed with Data practices and technologies including data lake, data warehousing, data integration patterns (ETL, services, messaging), analytics and business intelligence. * Hands-on experience on some of the following - AWS Lambda, Fargate, SQS, DynamoDB and Serverless AWS RDS and Redshift. * Open-source frameworks and developing native Cloud solutions. * Highly experienced in using SQL"
Data Science Lead,Searchability (UK) Ltd,"Salford, Greater Manchester",Up to £85000 per annum,Posted 7 days ago,"We combine the expertise throughout our team surrounding innovation, research and development to create cutting edge products that assist in solving any problems our customers might have. This ultimately makes the world more safe and secure. * Salary up to £85,000 + attractive benefits * Office in Salford Quays with hybrid working model * Navigation Systems experience * Machine Learning, AWS, Python * Provide technical leadership and be a focal point for data engineering, machine learning, cloud, DevOps and Software Engineering teams * Leading on engagement with customers * Play a role in bids and technical proposals * Work alongside Delivery Lead/Project Manager to develop roadmaps, understand delivery timescales and communicate these to the customer * 6% performance bonus * £3,000 DV bonus * Salary up to £85,000 * Experience designing and building data platforms"
Data Engineer Mid Senior Salford,BBC,"Salford, Greater Manchester",Competitive Salary + Benefits,Posted 28 days ago,"Job Introduction Are you looking for a role that builds on your experience with engineering data systems? Are you keen to learn, grow, and develop? Do you want to work in a nurturing culture where you can flourish and be your best? Would you like to work on services that are used by key BBC products and millions of people each day? If so, this opportunity could be for you. We are currently looking for talented Data Engineers to join our data teams here in the BBC. We are looking for talent at all levels that have a passion for engineering software with a focus on managing the huge amounts of data we manage and the systems that support it all. We currently have roles open in London, Manchester and Glasgow working in a hybrid way."
Data Architect,Michael Page Technology,"M1, Manchester","excellent benefits, pension,",Recently,"This is an exciting opportunity to join an established Enterprise Architecture (EA) function and make a real difference, by helping define and driving our Data and Integration strategy. Being data driven is a key component of our strategy and this role will put you right at the heart of helping the business to make business decisions that are underpinned by data. Client Details With offices in Manchester, we are a globally-recognised and innovative technology brand committed to being at the side of its customers. The company now has operations in more than 40 countries and regions with more than 30,000 employees. Our products include printers, all-in-one print devices, scanners and labelling machines."
Data Consultant- Remote,Customer Management Resourcing,"M30, Manchester",Unspecified,Posted 34 days ago,"Data Consultant Competitive Salary + exceptional benefits and career progression! Manchester- Remote working with travel. Permanent Our award-winning client are currently recruiting for a number of Data Consultants with a range of experience on a permanent basis in a number of locations across the United Kingdom. If you have excellent problem-solving skills, this role is a brilliant opportunity to develop your analytical skills and experience. Youll solve complex business problems, using data analytics to provide practical value-based solutions. You will be responsible for delivering data focused projects and engagements across multiple industries, you will be solutions focused and able to build strong relationships and have excellent problem-solving capabilities! If successful you will join a growing organisation with exciting plans for the future!"
Senior Data Engineer,IQ TECH NORTH,"Manchester, Greater Manchester",£65k - 70k per year + great benefits package!,Posted 38 days ago,"* Hybrid (2 days on site, rest from home) * Based in either Manchester * Salary up to £70k * Permanent * Must be currently living locally, in or near Manchester - Managing and mentoring a team of data engineers, delivering data engineering on a range of complex research processes, working closely with researchers, projects managers and data scientists - Working with a range of data sources such as CRM, sales, research and HR data - Building Single Customer Views or CDPs or Data Warehouses/Data Lakes to merge disparate data sets for marketing or sales activation - Building and configuring data ingestion methods from APIs, flat files, streaming, public data sources and survey data - Pushing forward processes and capability in the field of data management and engineering - Constantly looking at new technologies and approaches that improve processes"
Data Business Analyst,DGH Recruitment Ltd,"Manchester, Greater Manchester",£45000 - £59000 per annum,Posted 37 days ago,"We are currently recruiting for our client, an award-winning organisation. They are look for a strong Data Business Analyst to join their Data team. You will be responsible for developing high quality data user stories, data mock-ups and business data definitions. - A strong background in data requirement elicitation using agile practices, and broad understanding of data visualisation, data engineering and data governance. - Experience of planning and facilitating workshops of varying size. - Experience of influencing and managing stakeholders, with the ability to communicate key messages across multiple areas of the business. This role will be based in either Manchester, and is offered on a flexible hybrid basis with 1 day a week being in the office. The client is offering a competitive salary up to £59,000 per annum (DoE)."
BI Analyst,Innova Recruitment,"M25, Manchester","From £33,000 to £40,000 per annum Fully Remote",Recently,"Business Intelligence Analyst £31,000-£40,000 + 5% Pension match, fully remote, excellent career progression. Manchester HQ (Fully remote) There's a brilliant opportunity for a Business Intelligence Analyst to join a data team and derive insights that will affect the experience of hundreds of millions of customers every year. No longer will your friends not understand what you do for a living, they will likely use your products you work on most years. And, even if they don't, plenty of people are using these £multi-million revenue platforms. The business has 3 departments within Data. Data Engineering, Data Science and Business Intelligence. They are in the process of building a new data environment and want to ensure there is data democritization across the business."
BOM Co-ordinator,Gresham Office Furniture Ltd,"Bolton, Greater Manchester, BL6 4SA","From £19,000 to £21,000 per annum Exceptional package, and benefits",Recently,"Gresham Office Furniture has been designing furniture and workspaces in Bolton since 1976. We provide office furniture that meets the highest standards of quality, service and value as measured by our customers, and we believe that each of our team members are vitally important to helping us achieve this whether that is working on our shop floor producing our products or providing support to our customers. Due to continued growth, we are looking for a BOM Coordinator to create and release Bill of Materials (BOM). You will be responsible for maintaining and utilising the ERP systems to ensureBOMS and data input are effectively managed in order to support the Routings and material supply from purchasing requirements through stores, into production and shipping into final customer."
Data Engineer,Natwest,"M3, Salford, M3 3AQ",Competitive,Recently,"Join us as a Data Engineer * This is an exciting opportunity to use your technical expertise to collaborate with colleagues and build effortless, digital first customer experiences * You'll be simplifying the bank through developing innovative data driven solutions, inspiring to be commercially successful through insight, and keeping our customers and the bank safe and secure * Participating actively in the data engineering community, you'll deliver opportunities to support our strategic direction while building your network across the bank * We're recruiting for multiple roles across a range to levels, up to and including experienced managers What you'll do We'll look to you to drive value for the customer through modelling, sourcing and data transformation."
Data Platform Engineer,Natwest,"M3, Salford, M3 3AQ",Competitive,Recently,"Join us as a Data Platform Engineer * This is an exciting opportunity to use your technical expertise to collaborate with colleagues and build effortless, digital first customer experiences * You'll be simplifying the bank through developing innovative data driven solutions, inspiring to be commercially successful through insight, and keeping our customers and the bank safe and secure * Participating actively in the data engineering community, you'll deliver opportunities to support our strategic direction while building your network across the bank * We're recruiting for multiple roles across a range to levels, up to and including experienced managers What you'll do We'll look to you to drive value for the customer through modelling, sourcing and data transformation."
Data Architect,Natwest,"M3, Salford, M3 3AQ",Competitive,Recently,"Join us as a Data Architect * This is an exciting opportunity to work in the latest technology trends and use your technical expertise to collaborate with colleagues and build effortless, digital first customer experiences * You'll be simplifying the bank through developing innovative data driven solutions, inspiring to be commercially successful through insight, and keeping our customers and the bank safe and secure * Participating actively in the broader data architecture and modelling community, you'll deliver opportunities to support our strategic direction while building your network across the bank What you'll do We'll look to you to drive value for the customer through modelling, sourcing and data transformation."
Data Science Lead,Natwest,"M3, Salford, M3 3AQ",Competitive,Recently,"Join us as a Data Science Lead * This is an exciting opportunity to use your technical expertise to collaborate with colleagues and build effortless, digital first customer experiences * You'll be simplifying the bank through developing innovative data driven solutions, inspiring to be commercially successful through insight, and keeping our customers and the bank safe and secure * Participating actively in the data community, you'll deliver opportunities to support our strategic direction while building your network across the bank What you'll do We'll look to you to drive value for the customer through modelling, sourcing and data transformation. You'll be working closely with core technology and architecture teams to deliver strategic data solutions, while driving Agile and DevOps adoption in the delivery of data engineering."
Data Analytics Lead,Natwest,"M3, Salford, M3 3AQ",Competitive,Recently,"Join us as a Data Analytics Lead * This is an exciting opportunity to use your technical expertise to collaborate with colleagues and build effortless, digital first customer experiences * You'll be simplifying the bank through developing innovative data driven solutions, inspiring to be commercially successful through insight, and keeping our customers and the bank safe and secure * Participating actively in the data community, you'll deliver opportunities to support our strategic direction while building your network across the bank What you'll do We'll look to you to drive value for the customer through sourcing and data transformation. You'll be working closely with core technology and architecture teams to deliver strategic data solutions, while driving Agile and DevOps adoption in the delivery of data engineering."
"Data & Analytics, Internship",Natwest,"M3, Salford, M3 3AQ",Competitive,Recently,"About you * To be eligible for our Data & Analytics internship , you'll need to be in your penultimate year of university and be on course to achieving a 2:1 in your degree * C urious and inquisitive with a real passion for data and technology, and the drive to explore how it can be used to make a positive difference for our customers * You'll bring strong problem-solving skills, along with an analytical approach and an appreciation of analysis techniques About the programme Over the course of t his eight-week summer internship , we'll give you a taste of what it's like to work with us, along with valuable experience to help guide your career choices. This is your chance to act as a bridge between our data and stakeholders - developing dashboards that analyse trends and communicating insights to help us make better data-driven decisions."
Data & Analytics - Graduate Programme,Natwest,"M3, Salford, M3 3AQ",Competitive,Recently,"Locations: Manchester, 1 Hardman Boulevard About you * To be eligible for our Data and Analytics graduate programme, you'll need to have, or be on course to achieving a 2:1 in your degree * We're looking for curious, inquisitive people who show a real passion for data and technology, and the drive to explore how it can be used to make a positive difference for our customers * You'll bring strong problem solving skills, along with an analytical approach and an appreciation of analysis techniques. About the programme As a graduate trainee in Data and Analytics we'll equip you with the knowledge, skills and experiences you'll need to make a significant impact and become a leading data expert."
Engineering Internship 2023 - Operations,Amazon,UK,Competitive,Today,"Job summary Please note: These internships are based all over the UK. You may need to relocate for the duration of the internship. An engineering internship in Amazon will provide you with an unforgettable experience in a dynamic and international environment. Our internships serve to be an educational experience, where you will put your skills and bias for action to the test, to complete a project that will support your own learning in the engineering field. The engineering team in amazon maintain and optimize all technologies in the Global Amazon Warehouse & Delivery Network ranging from large, modern, purpose-built warehouses utilizing robotics and high-volume conveyance all the way through the value chain to small, high speed, delivery stations placed as close to our customers as possible."
Senior Reliability Maintenance Engineering Technician,Amazon,UK,Competitive,Today,"Amazon Operations sits at the heart of the Amazon customer experience. We look after everything from the moment a customer clicks buy, to the moment their item is delivered from desktop to doorstep. Across Europe we have more than 50 Fulfillment Centers, hundreds of Delivery Stations, thousands of machines, and tens of thousands of employees, all working together in harmony to make sure the right item gets delivered to the right person, in the right place, at the right time. Working in Amazon Operations is for people who like to be active and give their all. We work in a busy, dynamic environment and are part of a bigger team delivering on the expectations of millions of customers every single day. We are open, inclusive and welcome individuality and diversity."
Senior Data Engineer,Ascent People Ltd,"City Centre, M1",£65000 - £70000 per annum + Benefits,Today,"My client, a leading fintech company is looking for a Lead Data Engineer with a proven background in business intelligence architecture and implementation, alongside a track record of database administration to join their team. Reporting to the Head of IT Development you will be given the opportunity to work with cutting-edge technology maintaining your competitive advantage. To enable the most effective data-driven decision in order to carry out meaningful insight to improve efficiency and recognise opportunities. You will be supporting and working alongside internal teams (Risk, MI, and Operations) and my clients' customers to visualise the potential of the data and how it can be used effectively. Key Responsibilities for the Lead Data Engineer * Defining and building data warehouse and reporting solutions"
Full Stack Software Engineer - Children's Games Engineering,BBC,"Salford, Greater Manchester",Competitive Salary + Benefits,Yesterday,Job Introduction The Games team oversees all the games you can find across the world famous CBeebies and CBBC product portfolio. We're a small team that cares about building quality products for kids who love games. * Games Hosting - AWS backed infrastructure with a React front end * In-house Game Engines - HTML5/JavaScript engines based on PixiJS and Phaser * Delivery Pipeline - Maintenance and development of CI pipeline and SDK and guidelines * Testing Tools - Various tools to aid with QA and debugging of HTML5 games * Games Portfolio - Portfolio of over 300 games Our long-term strategy is to improve and redefine how games are made and delivered at the BBC and ultimately improve the important role they play in the organisation.. Join us for an engaging experience with a unique set of challenges rather unlike anything else you get in the world of web development.
Regional Engineering Manager,Sainsbury's,"M4, Manchester, M4 3AL",Competitive plus benefits,Today,"Job Description Location: Northampton, Basingstoke, Worcester, Bristol & Bedford Are you highly motivated, with extensive knowledge of fleet, Mechanical Handling Equipment and compliance legislation, policies, and procedures, plus a firm grasp of end-to-end logistics operations? Then make the move to Sainsbury's and let your talent shine, as you play a vital fleet compliance role that will help ensure our shelves are packed full of everything from toilet rolls to prosecco to toothpaste - whenever they're needed. You don't get from being a small shop in 1869 to one of the UK's most loved retailers without a passion for innovation and a relentless pursuit for better. And that's where you come in because, right now, we're looking for a Regional Fleet Manager to join the Analytics & Compliance team covering our Northampton, Basingstoke, Worcester, Bristol & Bedford sites"
